{
  "version": "1.0.0",
  "skills": {
    "github:vercel-labs/agent-skills/react-best-practices": {
      "version": "1.2.0",
      "installed_at": "2026-02-07T10:00:00Z",
      "source": "github",
      "evaluation": {
        "review_score": 95,
        "task_score": 93,
        "last_evaluated": "2026-02-07T10:30:00Z"
      },
      "metadata": {
        "name": "react-best-practices",
        "description": "React and Next.js performance optimization guidelines from Vercel Engineering",
        "categories": ["frontend", "performance", "react", "nextjs"],
        "author": "vercel-labs",
        "license": "MIT"
      }
    },
    "github:vercel-labs/agent-skills/web-design-guidelines": {
      "version": "1.0.0",
      "installed_at": "2026-02-07T11:00:00Z",
      "source": "github",
      "evaluation": {
        "review_score": 92,
        "task_score": 89,
        "last_evaluated": "2026-02-07T11:30:00Z"
      },
      "metadata": {
        "name": "web-design-guidelines",
        "description": "Review UI code for compliance with web interface best practices",
        "categories": ["frontend", "design", "accessibility", "ux"],
        "author": "vercel-labs",
        "license": "MIT"
      }
    },
    "local:./custom-skills/dbt-workflow": {
      "version": "*",
      "installed_at": "2026-02-06T15:00:00Z",
      "source": "local",
      "metadata": {
        "name": "dbt-workflow",
        "description": "Simple dbt workflow patterns for data transformation",
        "categories": ["data-engineering", "dbt", "analytics"],
        "author": "internal"
      }
    }
  },
  "lockfile": {
    "github:vercel-labs/agent-skills/react-best-practices": {
      "resolved": "https://raw.githubusercontent.com/vercel-labs/agent-skills/v1.2.0/skills/react-best-practices/SKILL.md",
      "integrity": "sha256:a1b2c3d4e5f6...",
      "dependencies": []
    },
    "github:vercel-labs/agent-skills/web-design-guidelines": {
      "resolved": "https://raw.githubusercontent.com/vercel-labs/agent-skills/v1.0.0/skills/web-design-guidelines/SKILL.md",
      "integrity": "sha256:b2c3d4e5f6a7...",
      "dependencies": []
    }
  },
  "config": {
    "registry_url": "https://registry.agentic-sdlc.io",
    "auto_update": false,
    "evaluation_required": false,
    "migrated_from_external": true,
    "migration_date": "2026-02-07T10:00:00Z"
  }
}
